### ISSUE TITLE
[Feature]

### ISSUE THREAD

**Issue by NobinPegasus** [Asphaltt/tc-dump#2]
Hello,
It's a great tool you built. I'm really loving it and using it for my project. However a feature that it's missing is being able to capture the openconnect vpn packet which tcpdump or wireshark can.

Doing analysis I found that this is the structure of a openconnect packet seen from the tunnel interface

![image](https://github.com/Asphaltt/tc-dump/assets/56520367/81a25e06-63d1-40c1-acdc-6d440ea1e85b)

This is the initial TCP SYN req:
```
Frame 851: 60 bytes on wire (480 bits), 60 bytes captured (480 bits) on interface tun0, id 0
    Section number: 1
    Interface id: 0 (tun0)
        Interface name: tun0
    Encapsulation type: Raw IP (7)
    Arrival Time: Apr  7, 2024 01:15:12.471308224 +06
    [Time shift for this packet: 0.000000000 seconds]
    Epoch Time: 1712430912.471308224 seconds
    [Time delta from previous captured frame: 0.017654170 seconds]
    [Time delta from previous displayed frame: 0.017654170 seconds]
    [Time since reference or first frame: 13.120854593 seconds]
    Frame Number: 851
    Frame Length: 60 bytes (480 bits)
    Capture Length: 60 bytes (480 bits)
    [Frame is marked: False]
    [Frame is ignored: False]
    [Protocols in frame: raw:ip:tcp]
    [Coloring Rule Name: TCP SYN/FIN]
    [Coloring Rule String: tcp.flags & 0x02 || tcp.flags.fin == 1]
Raw packet data
Internet Protocol Version 4, Src: 192.168.1.137, Dst: 185.199.108.153
    0100 .... = Version: 4
    .... 0101 = Header Length: 20 bytes (5)
    Differentiated Services Field: 0x00 (DSCP: CS0, ECN: Not-ECT)
        0000 00.. = Differentiated Services Codepoint: Default (0)
        .... ..00 = Explicit Congestion Notification: Not ECN-Capable Transport (0)
    Total Length: 60
    Identification: 0xe1bd (57789)
    010. .... = Flags: 0x2, Don't fragment
        0... .... = Reserved bit: Not set
        .1.. .... = Don't fragment: Set
        ..0. .... = More fragments: Not set
    ...0 0000 0000 0000 = Fragment Offset: 0
    Time to Live: 64
    Protocol: TCP (6)
    Header Checksum: 0x706c [validation disabled]
    [Header checksum status: Unverified]
    Source Address: 192.168.1.137
    Destination Address: 185.199.108.153
Transmission Control Protocol, Src Port: 51446, Dst Port: 443, Seq: 0, Len: 0
    Source Port: 51446
    Destination Port: 443
    [Stream index: 39]
    [Conversation completeness: Complete, WITH_DATA (63)]
    [TCP Segment Len: 0]
    Sequence Number: 0    (relative sequence number)
    Sequence Number (raw): 4275284642
    [Next Sequence Number: 1    (relative sequence number)]
    Acknowledgment Number: 0
    Acknowledgment number (raw): 0
    1010 .... = Header Length: 40 bytes (10)
    Flags: 0x002 (SYN)
        000. .... .... = Reserved: Not set
        ...0 .... .... = Accurate ECN: Not set
        .... 0... .... = Congestion Window Reduced: Not set
        .... .0.. .... = ECN-Echo: Not set
        .... ..0. .... = Urgent: Not set
        .... ...0 .... = Acknowledgment: Not set
        .... .... 0... = Push: Not set
        .... .... .0.. = Reset: Not set
        .... .... ..1. = Syn: Set
            [Expert Info (Chat/Sequence): Connection establish request (SYN): server port 443]
                [Connection establish request (SYN): server port 443]
                [Severity level: Chat]
                [Group: Sequence]
        .... .... ...0 = Fin: Not set
        [TCP Flags: ··········S·]
    Window: 65518
    [Calculated window size: 65518]
    Checksum: 0x48c9 [unverified]
    [Checksum Status: Unverified]
    Urgent Pointer: 0
    Options: (20 bytes), Maximum segment size, SACK permitted, Timestamps, No-Operation (NOP), Window scale
        TCP Option - Maximum segment size: 1394 bytes
            Kind: Maximum Segment Size (2)
            Length: 4
            MSS Value: 1394
        TCP Option - SACK permitted
            Kind: SACK Permitted (4)
            Length: 2
        TCP Option - Timestamps
            Kind: Time Stamp Option (8)
            Length: 10
            Timestamp value: 2588870784: TSval 2588870784, TSecr 0
            Timestamp echo reply: 0
        TCP Option - No-Operation (NOP)
            Kind: No-Operation (1)
        TCP Option - Window scale: 7 (multiply by 128)
            Kind: Window Scale (3)
            Length: 3
            Shift count: 7
            [Multiplier: 128]
    [Timestamps]
        [Time since first frame in this TCP stream: 0.000000000 seconds]
        [Time since previous frame in this TCP stream: 0.000000000 seconds]
```
![image](https://github.com/Asphaltt/tc-dump/assets/56520367/2f71b472-b1fe-4120-8844-cf9fe74b9846)

Here's the TCP ACK output
```
Frame 922: 52 bytes on wire (416 bits), 52 bytes captured (416 bits) on interface tun0, id 0
    Section number: 1
    Interface id: 0 (tun0)
        Interface name: tun0
    Encapsulation type: Raw IP (7)
    Arrival Time: Apr  7, 2024 01:15:12.945001492 +06
    [Time shift for this packet: 0.000000000 seconds]
    Epoch Time: 1712430912.945001492 seconds
    [Time delta from previous captured frame: 0.001444088 seconds]
    [Time delta from previous displayed frame: 0.001444088 seconds]
    [Time since reference or first frame: 13.594547861 seconds]
    Frame Number: 922
    Frame Length: 52 bytes (416 bits)
    Capture Length: 52 bytes (416 bits)
    [Frame is marked: False]
    [Frame is ignored: False]
    [Protocols in frame: raw:ip:tcp]
    [Coloring Rule Name: TCP SYN/FIN]
    [Coloring Rule String: tcp.flags & 0x02 || tcp.flags.fin == 1]
Raw packet data
Internet Protocol Version 4, Src: 192.168.1.137, Dst: 185.199.108.153
    0100 .... = Version: 4
    .... 0101 = Header Length: 20 bytes (5)
    Differentiated Services Field: 0x00 (DSCP: CS0, ECN: Not-ECT)
        0000 00.. = Differentiated Services Codepoint: Default (0)
        .... ..00 = Explicit Congestion Notification: Not ECN-Capable Transport (0)
    Total Length: 52
    Identification: 0xe1d1 (57809)
    010. .... = Flags: 0x2, Don't fragment
        0... .... = Reserved bit: Not set
        .1.. .... = Don't fragment: Set
        ..0. .... = More fragments: Not set
    ...0 0000 0000 0000 = Fragment Offset: 0
    Time to Live: 64
    Protocol: TCP (6)
    Header Checksum: 0x7060 [validation disabled]
    [Header checksum status: Unverified]
    Source Address: 192.168.1.137
    Destination Address: 185.199.108.153
Transmission Control Protocol, Src Port: 51446, Dst Port: 443, Seq: 790, Ack: 36580, Len: 0
    Source Port: 51446
    Destination Port: 443
    [Stream index: 39]
    [Conversation completeness: Complete, WITH_DATA (63)]
    [TCP Segment Len: 0]
    Sequence Number: 790    (relative sequence number)
    Sequence Number (raw): 4275285432
    [Next Sequence Number: 791    (relative sequence number)]
    Acknowledgment Number: 36580    (relative ack number)
    Acknowledgment number (raw): 89604416
    1000 .... = Header Length: 32 bytes (8)
    Flags: 0x011 (FIN, ACK)
        000. .... .... = Reserved: Not set
        ...0 .... .... = Accurate ECN: Not set
        .... 0... .... = Congestion Window Reduced: Not set
        .... .0.. .... = ECN-Echo: Not set
        .... ..0. .... = Urgent: Not set
        .... ...1 .... = Acknowledgment: Set
        .... .... 0... = Push: Not set
        .... .... .0.. = Reset: Not set
        .... .... ..0. = Syn: Not set
        .... .... ...1 = Fin: Set
            [Expert Info (Chat/Sequence): Connection finish (FIN)]
                [Connection finish (FIN)]
                [Severity level: Chat]
                [Group: Sequence]
        [TCP Flags: ·······A···F]
            [Expert Info (Note/Sequence): This frame initiates the connection closing]
                [This frame initiates the connection closing]
                [Severity level: Note]
                [Group: Sequence]
    Window: 502
    [Calculated window size: 64256]
    [Window size scaling factor: 128]
    Checksum: 0x2e00 [unverified]
    [Checksum Status: Unverified]
    Urgent Pointer: 0
    Options: (12 bytes), No-Operation (NOP), No-Operation (NOP), Timestamps
        TCP Option - No-Operation (NOP)
            Kind: No-Operation (1)
        TCP Option - No-Operation (NOP)
            Kind: No-Operation (1)
        TCP Option - Timestamps
            Kind: Time Stamp Option (8)
            Length: 10
            Timestamp value: 2588871258: TSval 2588871258, TSecr 4143842486
            Timestamp echo reply: 4143842486
    [Timestamps]
        [Time since first frame in this TCP stream: 0.473693268 seconds]
        [Time since previous frame in this TCP stream: 0.001444088 seconds]
```

![image](https://github.com/Asphaltt/tc-dump/assets/56520367/fe3b9349-dab5-4881-8143-f1aa9c5356fd)

TCP RST:
```
Frame 928: 40 bytes on wire (320 bits), 40 bytes captured (320 bits) on interface tun0, id 0
    Section number: 1
    Interface id: 0 (tun0)
        Interface name: tun0
    Encapsulation type: Raw IP (7)
    Arrival Time: Apr  7, 2024 01:15:13.081514186 +06
    [Time shift for this packet: 0.000000000 seconds]
    Epoch Time: 1712430913.081514186 seconds
    [Time delta from previous captured frame: 0.000036170 seconds]
    [Time delta from previous displayed frame: 0.000036170 seconds]
    [Time since reference or first frame: 13.731060555 seconds]
    Frame Number: 928
    Frame Length: 40 bytes (320 bits)
    Capture Length: 40 bytes (320 bits)
    [Frame is marked: False]
    [Frame is ignored: False]
    [Protocols in frame: raw:ip:tcp]
    [Coloring Rule Name: TCP RST]
    [Coloring Rule String: tcp.flags.reset eq 1]
Raw packet data
Internet Protocol Version 4, Src: 192.168.1.137, Dst: 185.199.108.153
    0100 .... = Version: 4
    .... 0101 = Header Length: 20 bytes (5)
    Differentiated Services Field: 0x00 (DSCP: CS0, ECN: Not-ECT)
        0000 00.. = Differentiated Services Codepoint: Default (0)
        .... ..00 = Explicit Congestion Notification: Not ECN-Capable Transport (0)
    Total Length: 40
    Identification: 0x0000 (0)
    010. .... = Flags: 0x2, Don't fragment
        0... .... = Reserved bit: Not set
        .1.. .... = Don't fragment: Set
        ..0. .... = More fragments: Not set
    ...0 0000 0000 0000 = Fragment Offset: 0
    Time to Live: 64
    Protocol: TCP (6)
    Header Checksum: 0x523e [validation disabled]
    [Header checksum status: Unverified]
    Source Address: 192.168.1.137
    Destination Address: 185.199.108.153
Transmission Control Protocol, Src Port: 51446, Dst Port: 443, Seq: 790, Len: 0
    Source Port: 51446
    Destination Port: 443
    [Stream index: 39]
    [Conversation completeness: Complete, WITH_DATA (63)]
    [TCP Segment Len: 0]
    Sequence Number: 790    (relative sequence number)
    Sequence Number (raw): 4275285432
    [Next Sequence Number: 790    (relative sequence number)]
    Acknowledgment Number: 0
    Acknowledgment number (raw): 0
    0101 .... = Header Length: 20 bytes (5)
    Flags: 0x004 (RST)
        000. .... .... = Reserved: Not set
        ...0 .... .... = Accurate ECN: Not set
        .... 0... .... = Congestion Window Reduced: Not set
        .... .0.. .... = ECN-Echo: Not set
        .... ..0. .... = Urgent: Not set
        .... ...0 .... = Acknowledgment: Not set
        .... .... 0... = Push: Not set
        .... .... .1.. = Reset: Set
            [Expert Info (Warning/Sequence): Connection reset (RST)]
                [Connection reset (RST)]
                [Severity level: Warning]
                [Group: Sequence]
        .... .... ..0. = Syn: Not set
        .... .... ...0 = Fin: Not set
        [TCP Flags: ·········R··]
    Window: 0
    [Calculated window size: 0]
    [Window size scaling factor: 128]
    Checksum: 0x5010 [unverified]
    [Checksum Status: Unverified]
    Urgent Pointer: 0
    [Timestamps]
        [Time since first frame in this TCP stream: 0.610205962 seconds]
        [Time since previous frame in this TCP stream: 0.000036170 seconds]
```

![image](https://github.com/Asphaltt/tc-dump/assets/56520367/db510459-b159-4b67-9571-91b6fd34cd0e)

Application Data over TLSv1.3
```
Frame 921: 76 bytes on wire (608 bits), 76 bytes captured (608 bits) on interface tun0, id 0
    Section number: 1
    Interface id: 0 (tun0)
        Interface name: tun0
    Encapsulation type: Raw IP (7)
    Arrival Time: Apr  7, 2024 01:15:12.943557404 +06
    [Time shift for this packet: 0.000000000 seconds]
    Epoch Time: 1712430912.943557404 seconds
    [Time delta from previous captured frame: 0.000563921 seconds]
    [Time delta from previous displayed frame: 0.000563921 seconds]
    [Time since reference or first frame: 13.593103773 seconds]
    Frame Number: 921
    Frame Length: 76 bytes (608 bits)
    Capture Length: 76 bytes (608 bits)
    [Frame is marked: False]
    [Frame is ignored: False]
    [Protocols in frame: raw:ip:tcp:tls]
    [Coloring Rule Name: TCP]
    [Coloring Rule String: tcp]
Raw packet data
Internet Protocol Version 4, Src: 192.168.1.137, Dst: 185.199.108.153
    0100 .... = Version: 4
    .... 0101 = Header Length: 20 bytes (5)
    Differentiated Services Field: 0x00 (DSCP: CS0, ECN: Not-ECT)
        0000 00.. = Differentiated Services Codepoint: Default (0)
        .... ..00 = Explicit Congestion Notification: Not ECN-Capable Transport (0)
    Total Length: 76
    Identification: 0xe1d0 (57808)
    010. .... = Flags: 0x2, Don't fragment
        0... .... = Reserved bit: Not set
        .1.. .... = Don't fragment: Set
        ..0. .... = More fragments: Not set
    ...0 0000 0000 0000 = Fragment Offset: 0
    Time to Live: 64
    Protocol: TCP (6)
    Header Checksum: 0x7049 [validation disabled]
    [Header checksum status: Unverified]
    Source Address: 192.168.1.137
    Destination Address: 185.199.108.153
Transmission Control Protocol, Src Port: 51446, Dst Port: 443, Seq: 766, Ack: 36580, Len: 24
    Source Port: 51446
    Destination Port: 443
    [Stream index: 39]
    [Conversation completeness: Complete, WITH_DATA (63)]
    [TCP Segment Len: 24]
    Sequence Number: 766    (relative sequence number)
    Sequence Number (raw): 4275285408
    [Next Sequence Number: 790    (relative sequence number)]
    Acknowledgment Number: 36580    (relative ack number)
    Acknowledgment number (raw): 89604416
    1000 .... = Header Length: 32 bytes (8)
    Flags: 0x018 (PSH, ACK)
        000. .... .... = Reserved: Not set
        ...0 .... .... = Accurate ECN: Not set
        .... 0... .... = Congestion Window Reduced: Not set
        .... .0.. .... = ECN-Echo: Not set
        .... ..0. .... = Urgent: Not set
        .... ...1 .... = Acknowledgment: Set
        .... .... 1... = Push: Set
        .... .... .0.. = Reset: Not set
        .... .... ..0. = Syn: Not set
        .... .... ...0 = Fin: Not set
        [TCP Flags: ·······AP···]
    Window: 502
    [Calculated window size: 64256]
    [Window size scaling factor: 128]
    Checksum: 0x3c78 [unverified]
    [Checksum Status: Unverified]
    Urgent Pointer: 0
    Options: (12 bytes), No-Operation (NOP), No-Operation (NOP), Timestamps
        TCP Option - No-Operation (NOP)
            Kind: No-Operation (1)
        TCP Option - No-Operation (NOP)
            Kind: No-Operation (1)
        TCP Option - Timestamps
            Kind: Time Stamp Option (8)
            Length: 10
            Timestamp value: 2588871257: TSval 2588871257, TSecr 4143842486
            Timestamp echo reply: 4143842486
    [Timestamps]
        [Time since first frame in this TCP stream: 0.472249180 seconds]
        [Time since previous frame in this TCP stream: 0.000563921 seconds]
    [SEQ/ACK analysis]
        [This is an ACK to the segment in frame: 920]
        [The RTT to ACK the segment was: 0.000563921 seconds]
        [iRTT: 0.139363536 seconds]
        [Bytes in flight: 55]
        [Bytes sent since last PSH flag: 24]
    TCP payload (24 bytes)
Transport Layer Security
    TLSv1.3 Record Layer: Application Data Protocol: Hypertext Transfer Protocol
        Opaque Type: Application Data (23)
        Version: TLS 1.2 (0x0303)
        Length: 19
        Encrypted Application Data: e33c6853c64f6b889359fba465df37d362aa72
        [Application Data Protocol: Hypertext Transfer Protocol]
```

What I need is being able to just parse the Destination IP of these packets.
The Raw packet data size shows the same as Frame Size don't know why. Can you give some hints. How should I edit this code?

What your code is doing first parsing eth->ip->tcp
what I want raw->ip->tcp
If I would be able to skip the initial 52/40 bytes and then start parsing directly the IP Packets. It will be a great help.

Proof that Frame size and rawData size shows the same size
![image](https://github.com/Asphaltt/tc-dump/assets/56520367/5f511d3d-9421-4add-aebc-5ae4a36d5b7a)

![image](https://github.com/Asphaltt/tc-dump/assets/56520367/860c4fd1-99f9-400e-85ea-bab84d36be31)

![image](https://github.com/Asphaltt/tc-dump/assets/56520367/9305a099-b2a4-49ef-b265-e6a70282a6a0)

![image](https://github.com/Asphaltt/tc-dump/assets/56520367/f1480235-781c-4ddc-84e5-8dc31dc239f1)

**Comment by Asphaltt** [comment]
>  I'm really loving it and using it for my project.

It's great `tc-dump` can help for your project.

> Can you give some hints. How should I edit this code?

Is it able to recognise the raw data size in bpf code?

If it is able, it's OK to do:

1. Recognise raw packet size.
2. Fake ethernet layer info.
3. Skip raw packet len to get IP layer info.
4. Get next layer info.

**Comment by NobinPegasus** [comment]
I haven't read the whole codebase. Skimmed though the overall code. So what I'm trying to do is can add a optional flag like tc-dump --open-connect, when this flag is added, The code will look for protocols within the frame like this
raw:ip:tcp or raw:ip:tcp:tls. Like I said if it parses till the ip src, dest that's enough for me. 

Maybe first ignore the 40 bytes parse them as string or bytecode. Then go to IpParsing and tcpparsing as implemented on your code.

So I'm not sure on which files should I make the edits. To achieve this.

**Comment by NobinPegasus** [comment]
There's fetry_tc.c and tc_dump.c inside the bpf directory. Other's are helper functions .

**Comment by Asphaltt** [comment]
`copy_headers()` in `headers/tc_dump.h` is the function you should change.

**Comment by NobinPegasus** [comment]
@Asphaltt 
I'm doing wrong somewhere. Here I need an arbitrary slider. Where I can skip 0/40/70 whatever bytes I want for the ethernet header without parsing anything. Then for the rest of ip/tcp. It will work as usual.
```
        } else {                                                              \
            struct sk_buff *skb = (struct sk_buff *)(u64)__skb;               \
            void *skb_head = BPF_CORE_READ(skb, head);                        \
            void *data = skb_head + BPF_CORE_READ(skb, mac_header);           \
            bpf_printk("Inside else tc!");                                      \
            if (bpf_probe_read_kernel(ev->data + cpy_off, sizeof(*hdr),       \
                data + var_off) != 0)                                         \
                return;                                                       \
                                                                              \
            hdr = (typeof(hdr))(ev->data + cpy_off);                        \
            bpf_printk("Size of HDR %d\n", sizeof(*hdr));                          \
            if (sizeof(*hdr)==14){                                  \
                cpy_off += 40;                            \
            }                                                       \
            else {                                                  \
            cpy_off += sizeof(*hdr);                                          \
            }                                                           \
            ev->total_len = cpy_off;                                          \
        }                                                                     \
    } while (0)
  ```
  I'm doing something wrong here.
  I've added these lines of code here to skip the first 40 bytes
  ```
              if (sizeof(*hdr)==14){                                  \
                cpy_off += 40;                            \
            }                                                       \
            else {                                                  \
            cpy_off += sizeof(*hdr);                                          \
            }     
   ```

**Comment by Asphaltt** [comment]
You should use two offsets, one is `cpy_off`, another one is `hdr_off`.

1. `cpy_off` is for copying data to your local buffer.
2. `hdr_off` is the offset in packet data.

As a result, `hdr_off` is the one you should skip 40 bytes, I think.

**Comment by Asphaltt** [comment]
Hi, is there any update?

**Comment by NobinPegasus** [comment]
Hello, I was out for a vacation. I tried to modify your code. But it seemed overkill for my trivial task.
Then I found this, and modified it according to my need.
https://github.com/georgenicoll/cilium-ebpf-tc
Thanks!
